<?xml version='1.0'  encoding="iso-8859-1"?>
 <!DOCTYPE proshop SYSTEM "ProshopVente.dtd">

<proshop datesysteme="2008-06-18T15:12:30">
	<ventes date="2008-06-07" magasin="003">
		<ticket numero="12564" heure="10:05:33"> 			
			<client>
				<code>152365425</code>
				<nom>AUFRAISE</nom>
				<prenom>charlotte</prenom>
				<adresse1>15 impasse du bout du monde</adresse1>
				<codepostal>33000</codepostal>
				<ville>BORDEAUX</ville>
			</client>
			<produits>
				<article libelle="pantalon toile" collection="E08">
					<type>V</type>
					<gencod>9001058674015</gencod>
					<taille>=TU</taille>
					<pvttc>4.50</pvttc>
					<quantite>2</quantite>
				</article>
				<article>
					<type>R</type>
					<gencod>FDP</gencod>
					<taille></taille>
					<pvttc>8.50</pvttc>
					<remise></remise>
					<coderemise></coderemise>
				</article>
			</produits>
			<reglements>
				<mode>
					<code>cb</code>
					<montant>11.0</montant>
				</mode>
			</reglements>
		</ticket>
	</ventes>
</proshop>
